ID,Key,Item Type,Publication Year,Author,Title,Publication Title,ISBN,ISSN,DOI,Url,Abstract Note,Date,Date Added,Date Modified,Access Date,Pages,Num Pages,Issue,Volume,Number Of Volumes,Journal Abbreviation,Short Title,Series,Series Number,Series Text,Series Title,Publisher,Place,Language,Rights,Type,Archive,Archive Location,Library Catalog,Call Number,Extra,Notes,File Attachments,Link Attachments,Manual Tags,Automatic Tags,Editor,Series Editor,Translator,Contributor,Attorney Agent,Book Author,Cast Member,Commenter,Composer,Cosponsor,Counsel,Interviewer,Producer,Recipient,Reviewed Author,Scriptwriter,Words By,Guest,Number,Edition,Running Time,Scale,Medium,Artwork Size,Filing Date,Application Number,Assignee,Issuing Authority,Country,Meeting Name,Conference Name,Court,References,Reporter,Legal Status,Priority Numbers,Programming Language,Version,System,Code,Code Number,Section,Session,Committee,History,Legislative Body,Value
13,EDDUDRVR,journalArticle,2014,"Rogovini, K A; Khrushcheva, A M; Shekarova, O N; Bushuev, A V; Sokolova, O V; Vasilieva, N Y",Immunocompetence and reproductive characteristics of male Campbell dwarf hamsters selected for low and high humoral immune response to SRBC: Testing the Immunocompetence Handicap Hypothesis,ZHURNAL OBSHCHEI BIOLOGII,,,,,"We selected Campbell dwarf hamsters (Phodopus campbelli Thomas, 1905) for low and high humoral immune response to the sheep red blood cells (SRBC) challenge in three generations (P, F1, F2). Nonspecific innate immunity and acquired T-cell immunity, resting metabolic rate, testosterone, and cortisole hormone levels, reproductive characteristics, including maturation related morphological traits, and aggressive behavior were studied within sets of males with low (LI) and high (HI) immune response to SRBC. We found no difference between LI and HI males in cutaneous response to injection of phytohemagglutinin, (DTH test for T-cell immunity), in activity of Peroxidase Endogenous Hydrogen Peroxide System of Neutrophils, in the white blood count, in resting metabolic rate, in body mass and ano-genital distance at the age of two months, in the blood level of testosterone before and after recurrent immunization by SRBC and in the blood level of cortisole in response to the social stressor (10 min encounter in the neutral arena). At that, LI males had significantly higher basal level of blood cortisole, were less aggressive in response to stranger male and had smaller testosterone-dependent mid-ventral specific skin gland at the age of two months. Males of two groups did not differ in the initial mating success with intact young females (time since pair formation until first litter born), although females of LI males born fewer number of pups. In fact, our results do not support the Handicap Immunocompetence Hypothesis (Folstad, Karter, 1999) which is based on the assumption of trade-off between immunocompetence and reproductive effort.",2014,14/02/2020 12:50,14/02/2020 12:50,,372–384,,5,75,,,,,,,,,,Russian,,,,,,,,,,,survival; ecological immunology; history trade-offs; phodopus; system; testosterone,,,,,,,,,,,,,,,,,,,,,,,,,,,,,,,,,,,,,,,,,,,,,,,,
14,ATTFZ6M4,journalArticle,2013,"Rhone, J A; Waldron, D F; Herring, A D","Performance of Boer-Spanish and Spanish goats in Texas I: Body weights, fertility, prolificacy, and number of kids weaned",J Anim Sci,,,10.2527/jas.2013-6227,https://www.ncbi.nlm.nih.gov/pubmed/23989872 https://watermark.silverchair.com/4679.pdf?token=AQECAHi208BE49Ooan9kkhW_Ercy7Dm3ZL_9Cf3qfKAc485ysgAAAnMwggJvBgkqhkiG9w0BBwagggJgMIICXAIBADCCAlUGCSqGSIb3DQEHATAeBglghkgBZQMEAS4wEQQMdnMB4wJNHnhMhkFJAgEQgIICJsl–,"Production records from 291 Boer-Spanish and Spanish does, collected between 1994 and 2004 in the Edwards Plateau region of West Texas, were examined to compare Boer-Spanish and Spanish does for body weights, fertility, prolificacy, and number of kids weaned. Traits were analyzed using single-trait mixed models. Boer-Spanish does were heavier at birth than Spanish does (2.79 vs. 2.67 kg, P = 0.05) but similar weight at weaning (15.2 vs. 15.0 kg, P = 0.59). Boer-Spanish does had a heavier body weight at breeding than Spanish does (46.5 vs. 43.5 kg, P \textless 0.01). Boer-Spanish does had similar fertility over 8 annual breeding seasons (0.87 vs. 0.84, P = .22). Boer-Spanish does had an advantage over Spanish does for fertility to a 30-d breeding season (0.53 vs. 0.48; P = .09). Boer-Spanish does produced more kids than Spanish does (1.70 vs. 1.62, P = .09). Boer-Spanish does weaned a similar number of kids (1.30 vs. 1.31, P = .76). Age of doe significantly affected (P \textless 0.05) both number of kids born and number of kids weaned, with older does giving birth to, and weaning, more kids. Boer-Spanish does had greater birth weight, body weight at breeding, and number of kids born than Spanish does. Boer-Spanish does had a similar number of kids weaned as Spanish does.",2013,14/02/2020 12:50,14/02/2020 12:50,,4679–4683,,10,91,,,,,,,,,,,,,,,,,PMID: 23989872,,,,Female; Pregnancy; Animals; Male; Litter Size; Weaning; Reproduction/*physiology; Birth Weight; Texas; Body Weight/*physiology; Environment; Genotype; Goats/genetics/*growth & development/*physiology,,,,,,,,,,,,,,,,,,,,,,,,,,,,,,,,,,,,,,,,,,,,,,,,
15,59TC6EWC,journalArticle,2014,"Rabon Jr., D R",Effects of age and experience on reproductive performance of captive red wolves (Canis rufus),Canadian Journal of Zoology,,,,https://www.scopus.com/inward/record.uri?eid=2-s2.0-84893971711&doi=10.1139%2Fcjz-2013-0226&partnerID=40&md5=f4e5a30d4c9788325c718cf833192f02,"Propagation programs contribute to the conservation of a species by preserving genetic and demographic stock that may be used to reinforce or re-establish wild populations. Identifying traits that affect reproductive success is essential to achieve this goal. Longitudinal reproductive events of the captive population of endangered red wolves (Canis rufus Audubon and Bachman, 1851) were investigated to determine whether parental age, breeding experience, and rearing type were factors in reproduction, litter size, and sex ratio, as well as viability of offspring. Younger wolves were more likely to reproduce and produce larger litters than were older individuals. The age of the female, but not the male, had a negative effect on pup survival. Wolves that had prior experience in offspring production were more likely to reproduce again than were individuals that had no prior reproductive success, but prior sexual experience alone was not a factor in offspring production. Parental breeding experience had a negative effect on pup survival, but no apparent relationships with litter size or sex ratio. Declines in reproduction, fitness, and survival with advancing age suggest the effect is due to senescence, the onset of which occurs at 8 years of age in females. The results are consistent with the breeding-experience hypothesis.",2014,14/02/2020 12:50,14/02/2020 12:50,,251–258,,3,92,,,,,,,,,,,,,,,,,,,,,Reproduction; Senescence; Age hypothesis; Breeding-experience hypothesis; Canis rufus; Red wolf; Reproductive experience,,,,,,,,,,,,,,,,,,,,,,,,,,,,,,,,,,,,,,,,,,,,,,,,
16,UGF4F5D6,journalArticle,2014,"Vasilieva, N A; Tchabovsky, A V",Timing is the only thing: reproduction in female yellow ground squirrels (Spermophilus fulvus),Canadian Journal of Zoology,,,10.1139/cjz-2014-0084,https://www.nrcresearchpress.com/doi/10.1139/cjz-2014-0084,"Based on 4-year field observations of yellow ground squirrels (Spermophilus fulvus (Lichtenstein, 1823)), we determined whether female reproductive effort, annual reproductive success, and survival were dependent on age, body condition, time of emergence from hibernation, and previous reproduction. The probability of weaning a litter did not vary with female age, body condition, time of emergence, or previous reproduction. Litter size, litter mass, and offspring survival did not vary with age, whereas individual offspring mass was lower in yearlings than in older females. Body condition upon emergence had no effect on litter size, litter mass, offspring mass, and survival. Reproduction did not influence female survival, physical condition upon emergence next spring, or subsequent reproductive efforts. The only factor that affected the extent of reproductive effort and offspring survival was the date of emergence: the later a female emerged, the lower the total and mean offspring mass, and fewer offspring survived. The modulation of reproduction in female S. fulvus by only the timing of vernal emergence and independent of other individual characteristics can be explained by the high costs of missed reproductive opportunity because of short longevity combined with low costs of reproduction when resources are abundant enough to meet both somatic and reproductive needs.",2014,14/02/2020 12:50,14/02/2020 12:50,,737–747,,8,92,,,,,,,,,,English,,,,,,,,,,,survival; life-history; trade-offs; body-weight; age; costs; hibernation; individual-differences; litter size; overwinter survival; reproductive costs; reproductive decisions; sexual differences; spermophilus fulvus; timing of reproduction; yellow ground squirrel,,,,,,,,,,,,,,,,,,,,,,,,,,,,,,,,,,,,,,,,,,,,,,,,
17,7US4MUGE,journalArticle,2010,"Omkar; Pandey, P; Rastogi, S; Mishra, G","Influence of age at mating on the reproductive performance of Parthenium beetle, Zygogramma bicolorata (Coleoptera: Chrysomelidae)",Insect Science,,,10.1111/j.1744-7917.2009.01301.x,https://onlinelibrary.wiley.com/doi/full/10.1111/j.1744-7917.2009.01301.x,"Age-specific mating incidence, sexual maturation and effect of age at mating on reproductive performance of the Parthenium beetle, Zygogramma bicolorata Pallister, was studied. Based on 50% mating incidence the calculated age of sexual maturation of males and females was 10.5 and 11.1 days, respectively, which was not statistically significant. However, on the basis of age at first mating, that is, sexual maturity, females matured 2 days earlier than males. Fecundity, pre-oviposition, oviposition and post-oviposition period and female longevity appear to be influenced by female age at mating with reproductive performance peaking at 30 days. On the other hand, egg viability was influenced by male age and was highest when males mated at the age of 40 days. To summarise, egg production and timing of egg deposition was female age-dependent, whereas egg fertility was male age-dependent. It was also observed that females mated at a later age and laid a higher number of eggs immediately after mating than did earlier mated females. This was ostensibly in a bid to increase fitness by maximizing reproductive output in the reduced life span available. This is the first investigation on the effect of age of females at mating on reproduction in this beetle.",2010,14/02/2020 12:50,14/02/2020 12:50,,112–120,,2,17,,,,,,,,,,English,,,,,,,,,,,egg viability; evolution; maternal age; paternal age; senescence; aphidophagous ladybird; butterflies; females; host deprivation; hysterophorus; lifetime fecundity; longevity; propylea-dissecta; zygogramma bicolorata,,,,,,,,,,,,,,,,,,,,,,,,,,,,,,,,,,,,,,,,,,,,,,,,